{
  "schema": "auto-g16-r33-p1-evidence-ledger/1",
  "ledger_id": "mobh35_r33_p1_review_20260716",
  "status": "blocked_incomplete_scientific_review",
  "review_date": "2026-07-16",
  "candidate_binding": {
    "candidate_id": "mobh35_r33_pt_h_scrambling",
    "inventory": {
      "path": "studies/metal_m4_p0_p1_baseline/r33-candidate-inventory.json",
      "sha256": "e810d3e8a17950345b0e71b2b3a7671ecc7136c693f8d803ac87069856542497",
      "schema": "gaussian-asymmetric-metal-p0-candidate-inventory/1"
    },
    "structures": {
      "path": "studies/metal_m4_p0_p1_baseline/r33-start-ts-end.xyz",
      "sha256": "f2104dc1db9f4fb44542d48c0321715f5060f4b99a80f1301bfe4c8aa277b5f3",
      "schema": "multi_xyz_start_ts_end_with_source_attribution/1"
    },
    "total_charge": 1,
    "multiplicity_candidate": 1,
    "formal_candidate_status": "not_emitted_existing_asymmetric_candidate_contract_semantically_unsatisfied"
  },
  "sources": [
    {
      "source_id": "r33_candidate_inventory",
      "source_type": "repository_artifact",
      "citation": "Auto-G16 R33 provisional P0 candidate inventory",
      "doi": null,
      "locator": "studies/metal_m4_p0_p1_baseline/r33-candidate-inventory.json",
      "retrieval": {
        "uri": null,
        "retrieved_at": null,
        "sha256": "e810d3e8a17950345b0e71b2b3a7671ecc7136c693f8d803ac87069856542497",
        "versioned_path": "studies/metal_m4_p0_p1_baseline/r33-candidate-inventory.json"
      },
      "supports": ["identity", "charge", "coordinates", "diagnostics", "source_limit"],
      "claim_ceiling": "Inventory and observations only; no M1 acceptance, protocol, TS, or live authority."
    },
    {
      "source_id": "r33_coordinate_blocks",
      "source_type": "repository_artifact",
      "citation": "MOBH35 R33 start, TS, and end coordinate blocks transcribed from ct1c01126_si_003.txt",
      "doi": "10.1021/acs.jctc.1c01126",
      "locator": "ct1c01126_si_003.txt blocks 33_start, 33_ts, and 33_end",
      "retrieval": {
        "uri": "https://www.ebi.ac.uk/europepmc/webservices/rest/PMC8830049/supplementaryFiles",
        "retrieved_at": "2026-07-16",
        "sha256": "105d7b83ea22660dfd3964bd62017f72a997eb2f936f7bb8c7a447704b885603",
        "versioned_path": "studies/metal_m4_p0_p1_baseline/r33-start-ts-end.xyz"
      },
      "supports": ["identity", "coordinates"],
      "claim_ceiling": "Ordered Cartesian coordinates and element inventory only; charge, multiplicity, roles, mode, and endpoint identities are absent from the coordinate text."
    },
    {
      "source_id": "semidalas_2022_full_text",
      "source_type": "primary_article",
      "citation": "Semidalas and Martin, J. Chem. Theory Comput. 2022, 18, 883-898",
      "doi": "10.1021/acs.jctc.1c01126",
      "locator": "Methods paragraphs beginning 'Where possible, conventional canonical CCSD(T)' and 'In order to get our bearings concerning static correlation diagnostics'",
      "retrieval": {
        "uri": "https://www.ebi.ac.uk/europepmc/webservices/rest/PMC8830049/fullTextXML",
        "retrieved_at": "2026-07-16",
        "sha256": "34c6890c02fb12a503fbff049a6119386d9e987ad79bcbdf84e57b2adee7888c",
        "versioned_path": null
      },
      "supports": ["multiplicity", "closed_shell_context", "diagnostics", "method_context", "source_limit"],
      "claim_ceiling": "The article reports that all investigated systems are closed-shell and that the lowest closed-shell singlet SCF solution was checked; it does not enumerate R33 alternative multiplicities or approve an Auto-G16 wavefunction policy."
    },
    {
      "source_id": "semidalas_2022_supplement_bundle",
      "source_type": "primary_supporting_information",
      "citation": "Semidalas and Martin 2022 lawful Europe PMC supplementary bundle",
      "doi": "10.1021/acs.jctc.1c01126",
      "locator": "Europe PMC supplementaryFiles response containing ct1c01126_si_001.pdf, ct1c01126_si_002.xlsx, and ct1c01126_si_003.txt",
      "retrieval": {
        "uri": "https://www.ebi.ac.uk/europepmc/webservices/rest/PMC8830049/supplementaryFiles",
        "retrieved_at": "2026-07-16",
        "sha256": "f0f400a94f841571d62b819a8c1807d2ddc9bb8f28afb0442988c49fb7451e56",
        "versioned_path": null
      },
      "supports": ["identity", "charge", "coordinates", "diagnostics", "method_context"],
      "claim_ceiling": "Container provenance only; each scientific claim remains bound to its member hash and locator."
    },
    {
      "source_id": "r33_diagnostics_workbook",
      "source_type": "primary_supporting_information",
      "citation": "ct1c01126_si_002.xlsx",
      "doi": "10.1021/acs.jctc.1c01126",
      "locator": "sheet Diagnostics Def2SV_P or Def2SVP rows 99-101 and formula cells O202:O204",
      "retrieval": {
        "uri": "https://www.ebi.ac.uk/europepmc/webservices/rest/PMC8830049/supplementaryFiles",
        "retrieved_at": "2026-07-16",
        "sha256": "39c7fa3cf3fd6eff751af34c8a458bfacdfb159f894672a3c3b87fd604a4a3b2",
        "versioned_path": null
      },
      "supports": ["identity", "charge", "diagnostics"],
      "claim_ceiling": "Reports CH11N2Pt(1+) and numerical diagnostics; it does not itself supply oxidation state, d count, multiplicity, or an acceptance threshold."
    },
    {
      "source_id": "mobh35_author_archive",
      "source_type": "author_archive",
      "citation": "Iron and Janes MOBH35 ChemRxiv v2 author archive mobh35-tar.tgz",
      "doi": "10.1021/acs.jpca.9b01546",
      "locator": "archive members r33+.xyz, ts33+.xyz, and p33+.xyz comments report CH11N2Pt+",
      "retrieval": {
        "uri": "https://chemrxiv.org/engage/chemrxiv/article-details/60c74167842e6505f1db1ea0",
        "retrieved_at": "2026-07-16",
        "sha256": "c5c0c0027129c392e81f61925d18a7a982ce1577c76fe48d2e9a54beb713fe78",
        "versioned_path": null
      },
      "supports": ["identity", "charge", "diagnostics", "source_limit"],
      "claim_ceiling": "Strengthens +1 charge provenance and reported diagnostic context; multiplicity and scientific acceptance are absent."
    },
    {
      "source_id": "iron_2002_figshare_metadata",
      "source_type": "primary_dataset_metadata",
      "citation": "Iron, Lo, Martin, and Keinan, JACS 2002 supporting dataset metadata",
      "doi": "10.1021/ja025667v.s003",
      "locator": "ACS Figshare API article 3642549, file 5731353, description and related-material fields",
      "retrieval": {
        "uri": "https://api.figshare.com/v2/articles/3642549",
        "retrieved_at": "2026-07-16",
        "sha256": "4b08bc3cef027c5588e24a9ec15b38557ddc45a2451a9a36b5bc9fb7c329b69f",
        "versioned_path": null
      },
      "supports": ["reaction_context", "method_context", "source_limit"],
      "claim_ceiling": "Metadata reports TpPtMe(H)2 H/D scrambling, an eta2-CH-CH4 complex, and a separate N3 ammonia model; it does not identify the N2 R33 reduced coordinate state."
    },
    {
      "source_id": "iron_2002_si_file_unread",
      "source_type": "primary_supporting_information",
      "citation": "ja025667v_si_003.txt",
      "doi": "10.1021/ja025667v.s003",
      "locator": "ACS Figshare file 5731353; size 46316; supplied MD5 9ec842c2537f2510f8a217dffff4e298",
      "retrieval": {
        "uri": "https://ndownloader.figshare.com/files/5731353",
        "retrieved_at": "2026-07-16",
        "sha256": null,
        "versioned_path": null
      },
      "supports": ["source_limit"],
      "claim_ceiling": "File content was not obtained because the upstream WAF/S3 path did not yield the object; no content claim is accepted."
    }
  ],
  "sections": {
    "electron_accounting": {
      "status": "blocked_missing_evidence",
      "facts": {
        "source_reported_total_charge": 1,
        "formal_oxidation_state": null,
        "ligand_charge_convention": null,
        "non_innocent_ligand_alternatives": null,
        "d_electron_count": null,
        "total_electron_count": null,
        "electron_parity": null,
        "electron_count_arithmetic_performed": false
      },
      "evidence_ids": ["r33_candidate_inventory", "r33_diagnostics_workbook", "mobh35_author_archive"],
      "review_notes": "Charge +1 is directly source-reported for the exact R33 data object. No oxidation, ligand-charge, d-count, total-electron, or parity value is copied or derived.",
      "blockers": [
        "Formal Pt oxidation state is not source-reported for the exact N2 R33 object.",
        "Ligand identities and charge conventions are not source-reported for the exact N2 R33 object.",
        "d-electron count, total electron count, and electron parity remain null rather than being inferred from elements or charge."
      ]
    },
    "spin_surface": {
      "status": "reviewed_observations_with_open_gates",
      "facts": {
        "source_reported_multiplicity_candidates": [
          {
            "multiplicity": 1,
            "basis": "The 2022 primary article states that all investigated systems are closed-shell and that convergence to the lowest closed-shell singlet SCF solution was verified."
          }
        ],
        "scientifically_accepted_multiplicity": null,
        "credible_alternative_multiplicities": null,
        "relative_spin_state_reference": null,
        "single_surface_assumption": null,
        "spin_crossover_relevance": null,
        "minimum_energy_crossing_relevance": null
      },
      "evidence_ids": ["semidalas_2022_full_text", "r33_coordinate_blocks"],
      "review_notes": "Multiplicity 1 is recorded as a source-reported candidate, not inferred from electron parity and not automatically scientifically accepted.",
      "blockers": [
        "No exact R33 source enumerates credible alternative multiplicities or their common energy reference.",
        "Single-surface, spin-crossover, two-state-reactivity, and MECP relevance have no candidate-bound reviewer decision."
      ]
    },
    "wavefunction": {